{
  "title": "When One Becomes Both",
  "author": "Peter Milimo",
  "cat": "Single Parenting & Family",
  "sub": "How Single Parents Rise, Heal and Build Strong Families Against All Odds",
  "desc": "A powerful, compassionate guide for single parents navigating the journey of raising a family alone — covering healing, resilience, identity, and building a home that thrives against every odd.",
  "price": "KSh 1,200",
  "format": "Softcopy (PDF / eBook)",
  "order": 1
}
