{
  "title": "The Thirteen Effective Pillars of a Covenant Marriage",
  "author": "Peter Milimo",
  "cat": "Marriage & Family",
  "sub": "A Biblical Guide for Building a Strong, Faithful & Divorce-Resistant Union",
  "desc": "An in-depth biblical roadmap through thirteen essential pillars every covenant marriage must stand on — equipping couples to build a strong, faithful, and divorce-resistant union grounded in God's Word.",
  "price": "KSh 1,200",
  "format": "Softcopy (PDF / eBook)",
  "order": 2
}
